{
  "schema": "portunix.modeler/v1",
  "units": "mm",
  "meta": {
    "name": "Sample house"
  },
  "layers": [
    {"id":"architecture","name":"Floor plan"},
    {"id":"electrical","name":"Electrical installation"},
    {"id":"titleblock","name":"Title block"}
  ],
  "entities": [
    {"id":"cir-zs101","kind":"circuit","layer":"electrical","props":{"designation":"ZS101","type":"socket","board":"RH","cable":"CYKY-J 3x2.5","protection":"B16"}},
    {"id":"cir-zs102","kind":"circuit","layer":"electrical","props":{"designation":"ZS102","type":"socket","board":"RH","cable":"CYKY-J 3x2.5","protection":"B16"}},
    {"id":"cir-zs103","kind":"circuit","layer":"electrical","props":{"designation":"ZS103","type":"power","board":"RH","cable":"CYKY-J 5x2.5","protection":"C16/3"}},
    {"id":"cir-zs104","kind":"circuit","layer":"electrical","props":{"designation":"ZS104","type":"socket","board":"RH","cable":"CYKY-J 3x2.5","protection":"B16"}},
    {"id":"cir-zs105","kind":"circuit","layer":"electrical","props":{"designation":"ZS105","type":"socket","board":"RH","cable":"CYKY-J 3x2.5","protection":"B16"}},
    {"id":"dev-board","kind":"device","parent":"w-w2","layer":"electrical","props":{"symbol":"core.board.power","label":"RH","offset":3200,"side":"left","mount":1500,"room":"1.01"}},
    {"id":"dev-pir","kind":"device","parent":"sto-1np","layer":"electrical","props":{"symbol":"core.sensor.presence","label":"TM1.01-1","at":[1500,1500],"room":"1.01"}},
    {"id":"dev-sv-bath","kind":"device","parent":"sto-1np","layer":"electrical","props":{"symbol":"core.light.ceiling","label":"SV1.04-1","at":[9000,7100],"room":"1.04"}},
    {"id":"dev-sv-bath-led","kind":"device","parent":"sto-1np","layer":"electrical","props":{"symbol":"core.light.led-strip","label":"SV1.04-2","path":{"points":[[6500,8500],[11500,8500]]},"room":"1.04"}},
    {"id":"dev-sv-bed","kind":"device","parent":"sto-1np","layer":"electrical","props":{"symbol":"core.light.ceiling","label":"SV1.03-1","at":[3000,7100],"room":"1.03"}},
    {"id":"dev-sv-kit","kind":"device","parent":"sto-1np","layer":"electrical","props":{"symbol":"core.light.ceiling","label":"SV1.02-1","at":[9000,2600],"room":"1.02"}},
    {"id":"dev-sv-liv","kind":"device","parent":"sto-1np","layer":"electrical","props":{"symbol":"core.light.ceiling","label":"SV1.01-1","at":[3000,2600],"room":"1.01"}},
    {"id":"dev-sw-bed","kind":"device","parent":"w-i1","layer":"electrical","props":{"symbol":"core.control.button-double","label":"TL1.03-1","offset":3900,"side":"left","mount":1200,"room":"1.03"}},
    {"id":"dev-sw-entry","kind":"device","parent":"w-s1","layer":"electrical","props":{"symbol":"core.control.button-single","label":"TL1.01-1","offset":2300,"side":"left","mount":1200,"room":"1.01"}},
    {"id":"dev-zs-bath","kind":"device","parent":"w-e2","layer":"electrical","props":{"symbol":"core.socket.single","label":"ZS105","circuit":"ZS105","offset":800,"side":"left","mount":1200,"room":"1.04"}},
    {"id":"dev-zs-bed-1","kind":"device","parent":"w-w1","layer":"electrical","props":{"symbol":"core.socket.single","label":"ZS104","circuit":"ZS104","offset":3700,"side":"left","mount":300,"room":"1.03"}},
    {"id":"dev-zs-kit-1","kind":"device","parent":"w-s2","layer":"electrical","props":{"symbol":"core.socket.single","label":"ZS102","circuit":"ZS102","offset":1000,"side":"left","mount":1100,"room":"1.02"}},
    {"id":"dev-zs-kit-3f","kind":"device","parent":"w-e1","layer":"electrical","props":{"symbol":"core.socket.three-phase","label":"ZS103","circuit":"ZS103","offset":3000,"side":"left","mount":300,"room":"1.02"}},
    {"id":"dev-zs-liv-1","kind":"device","parent":"w-w2","layer":"electrical","props":{"symbol":"core.socket.single","label":"ZS101","circuit":"ZS101","offset":1000,"side":"left","mount":300,"room":"1.01"}},
    {"id":"dev-zs-liv-2","kind":"device","parent":"w-i3","layer":"electrical","props":{"symbol":"core.socket.single","label":"ZS101","circuit":"ZS101","offset":1500,"side":"left","mount":300,"room":"1.01"}},
    {"id":"door-bath","kind":"door","parent":"w-i2","layer":"architecture","props":{"offset":800,"width":700,"height":2000,"hinge":"start","swing":"left"}},
    {"id":"door-bed","kind":"door","parent":"w-i1","layer":"architecture","props":{"offset":4200,"width":800,"height":2000,"hinge":"end","swing":"right"}},
    {"id":"door-entry","kind":"door","parent":"w-s1","layer":"architecture","props":{"offset":1000,"width":1000,"height":2100,"hinge":"start","swing":"left"}},
    {"id":"door-kitchen","kind":"door","parent":"w-i3","layer":"architecture","props":{"offset":2800,"width":800,"height":2000,"hinge":"end","swing":"left"}},
    {"id":"j1","kind":"junction","parent":"sto-1np","layer":"architecture","props":{"at":[0,0]}},
    {"id":"j2","kind":"junction","parent":"sto-1np","layer":"architecture","props":{"at":[6000,0]}},
    {"id":"j3","kind":"junction","parent":"sto-1np","layer":"architecture","props":{"at":[12000,0]}},
    {"id":"j4","kind":"junction","parent":"sto-1np","layer":"architecture","props":{"at":[12000,4000]}},
    {"id":"j5","kind":"junction","parent":"sto-1np","layer":"architecture","props":{"at":[12000,9000]}},
    {"id":"j6","kind":"junction","parent":"sto-1np","layer":"architecture","props":{"at":[6000,9000]}},
    {"id":"j7","kind":"junction","parent":"sto-1np","layer":"architecture","props":{"at":[0,9000]}},
    {"id":"j8","kind":"junction","parent":"sto-1np","layer":"architecture","props":{"at":[0,4000]}},
    {"id":"j9","kind":"junction","parent":"sto-1np","layer":"architecture","props":{"at":[6000,4000]}},
    {"id":"room-1","kind":"room","parent":"sto-1np","layer":"architecture","props":{"number":"1.01","name":"Obývací pokoj","polygon":[[0,0],[6000,0],[6000,4000],[0,4000]]}},
    {"id":"room-2","kind":"room","parent":"sto-1np","layer":"architecture","props":{"number":"1.02","name":"Kuchyň","polygon":[[6000,0],[12000,0],[12000,4000],[6000,4000]]}},
    {"id":"room-3","kind":"room","parent":"sto-1np","layer":"architecture","props":{"number":"1.03","name":"Ložnice","polygon":[[0,4000],[6000,4000],[6000,9000],[0,9000]]}},
    {"id":"room-4","kind":"room","parent":"sto-1np","layer":"architecture","props":{"number":"1.04","name":"Koupelna","polygon":[[6000,4000],[12000,4000],[12000,9000],[6000,9000]]}},
    {"id":"sto-1np","kind":"storey","props":{"name":"1NP","elevation":0,"height":2700}},
    {"id":"w-e1","kind":"wall","parent":"sto-1np","layer":"architecture","props":{"from":"j3","to":"j4","thickness":400,"height":2700}},
    {"id":"w-e2","kind":"wall","parent":"sto-1np","layer":"architecture","props":{"from":"j4","to":"j5","thickness":400,"height":2700}},
    {"id":"w-i1","kind":"wall","parent":"sto-1np","layer":"architecture","props":{"from":"j8","to":"j9","thickness":150,"height":2700}},
    {"id":"w-i2","kind":"wall","parent":"sto-1np","layer":"architecture","props":{"from":"j9","to":"j4","thickness":150,"height":2700}},
    {"id":"w-i3","kind":"wall","parent":"sto-1np","layer":"architecture","props":{"from":"j2","to":"j9","thickness":150,"height":2700}},
    {"id":"w-i4","kind":"wall","parent":"sto-1np","layer":"architecture","props":{"from":"j9","to":"j6","thickness":150,"height":2700}},
    {"id":"w-n1","kind":"wall","parent":"sto-1np","layer":"architecture","props":{"from":"j5","to":"j6","thickness":400,"height":2700}},
    {"id":"w-n2","kind":"wall","parent":"sto-1np","layer":"architecture","props":{"from":"j6","to":"j7","thickness":400,"height":2700}},
    {"id":"w-s1","kind":"wall","parent":"sto-1np","layer":"architecture","props":{"from":"j1","to":"j2","thickness":400,"height":2700}},
    {"id":"w-s2","kind":"wall","parent":"sto-1np","layer":"architecture","props":{"from":"j2","to":"j3","thickness":400,"height":2700}},
    {"id":"w-w1","kind":"wall","parent":"sto-1np","layer":"architecture","props":{"from":"j7","to":"j8","thickness":400,"height":2700}},
    {"id":"w-w2","kind":"wall","parent":"sto-1np","layer":"architecture","props":{"from":"j8","to":"j1","thickness":400,"height":2700}},
    {"id":"win-1","kind":"window","parent":"w-s1","layer":"architecture","props":{"offset":3500,"width":1500,"height":1500,"sill":900}},
    {"id":"win-2","kind":"window","parent":"w-s2","layer":"architecture","props":{"offset":2000,"width":2000,"height":1500,"sill":900}},
    {"id":"win-3","kind":"window","parent":"w-e1","layer":"architecture","props":{"offset":1200,"width":1500,"height":1500,"sill":900}},
    {"id":"win-4","kind":"window","parent":"w-e2","layer":"architecture","props":{"offset":1800,"width":1200,"height":1500,"sill":900}},
    {"id":"win-5","kind":"window","parent":"w-n1","layer":"architecture","props":{"offset":2000,"width":1500,"height":1500,"sill":900}},
    {"id":"win-6","kind":"window","parent":"w-n2","layer":"architecture","props":{"offset":1500,"width":2400,"height":1500,"sill":900}},
    {"id":"win-7","kind":"window","parent":"w-w1","layer":"architecture","props":{"offset":1500,"width":1800,"height":1500,"sill":900}},
    {"id":"win-8","kind":"window","parent":"w-w2","layer":"architecture","props":{"offset":1200,"width":1500,"height":1500,"sill":900}}
  ],
  "log": [
    {"seq":1,"op":"meta.set","props":{"name":"Sample house"}},
    {"seq":2,"op":"storey.add","id":"sto-1np","props":{"name":"1NP","elevation":0,"height":2700}},
    {"seq":3,"op":"junction.add","id":"j1","parent":"sto-1np","layer":"architecture","props":{"at":[0,0]}},
    {"seq":4,"op":"junction.add","id":"j2","parent":"sto-1np","layer":"architecture","props":{"at":[6000,0]}},
    {"seq":5,"op":"junction.add","id":"j3","parent":"sto-1np","layer":"architecture","props":{"at":[12000,0]}},
    {"seq":6,"op":"junction.add","id":"j4","parent":"sto-1np","layer":"architecture","props":{"at":[12000,4000]}},
    {"seq":7,"op":"junction.add","id":"j5","parent":"sto-1np","layer":"architecture","props":{"at":[12000,9000]}},
    {"seq":8,"op":"junction.add","id":"j6","parent":"sto-1np","layer":"architecture","props":{"at":[6000,9000]}},